{
  "$schema": "./contract-manifest-schema.json",
  "contract_name": "ProgramEscrowContract",
  "contract_purpose": "Handles hackathon and program prize pools with batch payouts, dependency management, circuit breaker protection, and comprehensive monitoring",
  "version": {
    "current": "2.0.0",
    "schema": "1.0.0",
    "history": [
      {
        "version": "1.0.0",
        "release_date": "2024-01-01",
        "changes": [
          "Initial release with basic program escrow",
          "Single program support",
          "Basic batch payout functionality"
        ]
      },
      {
        "version": "2.0.0",
        "release_date": "2024-06-01",
        "changes": [
          "Added multi-program support with registry",
          "Enhanced batch operations with atomicity",
          "Added dependency management system",
          "Implemented circuit breaker for error recovery",
          "Enhanced monitoring and analytics",
          "Added claim period functionality",
          "Improved fee configuration",
          "Added granular pause controls"
        ]
      }
    ]
  },
  "entrypoints": {
    "public": [
      {
        "name": "init_program",
        "description": "Initialize a new program with authorized payout key",
        "parameters": [
          {
            "name": "program_id",
            "type": "String",
            "description": "Unique program identifier"
          },
          {
            "name": "authorized_payout_key",
            "type": "Address",
            "description": "Address authorized to make payouts"
          },
          {
            "name": "token_address",
            "type": "Address",
            "description": "Token contract address"
          }
        ],
        "returns": {
          "type": "ProgramData",
          "description": "Initialized program data"
        },
        "authorization": "signer",
        "pausable": true,
        "gas_estimate": "medium"
      },
      {
        "name": "initialize_program",
        "description": "Initialize program with metadata and fee configuration",
        "parameters": [
          {
            "name": "program_id",
            "type": "String",
            "description": "Unique program identifier"
          },
          {
            "name": "authorized_payout_key",
            "type": "Address",
            "description": "Address authorized to make payouts"
          },
          {
            "name": "token_address",
            "type": "Address",
            "description": "Token contract address"
          },
          {
            "name": "metadata",
            "type": "String",
            "description": "Program metadata",
            "optional": true
          },
          {
            "name": "fee_config",
            "type": "FeeConfig",
            "description": "Fee configuration",
            "optional": true
          }
        ],
        "returns": {
          "type": "ProgramData",
          "description": "Initialized program data"
        },
        "authorization": "signer",
        "pausable": true,
        "gas_estimate": "medium"
      },
      {
        "name": "batch_initialize_programs",
        "description": "Initialize multiple programs in one transaction",
        "parameters": [
          {
            "name": "items",
            "type": "Vec<ProgramInitItem>",
            "description": "Array of program initialization requests"
          }
        ],
        "returns": {
          "type": "u32",
          "description": "Number of successfully initialized programs"
        },
        "authorization": "signer",
        "pausable": true,
        "gas_estimate": "high"
      },
      {
        "name": "lock_program_funds",
        "description": "Lock prize pool funds for a program",
        "parameters": [
          {
            "name": "program_id",
            "type": "String",
            "description": "Program identifier",
            "optional": true
          },
          {
            "name": "amount",
            "type": "i128",
            "description": "Amount to lock"
          }
        ],
        "returns": {
          "type": "ProgramData",
          "description": "Updated program data"
        },
        "authorization": "signer",
        "pausable": true,
        "gas_estimate": "medium"
      },
      {
        "name": "batch_payout",
        "description": "Distribute prizes to multiple winners",
        "parameters": [
          {
            "name": "winners",
            "type": "Vec<Address>",
            "description": "Array of winner addresses"
          },
          {
            "name": "amounts",
            "type": "Vec<i128>",
            "description": "Corresponding prize amounts"
          }
        ],
        "returns": {
          "type": "Vec<PayoutRecord>",
          "description": "Array of payout records"
        },
        "authorization": "admin",
        "pausable": true,
        "gas_estimate": "high"
      },
      {
        "name": "single_payout",
        "description": "Distribute prize to single winner",
        "parameters": [
          {
            "name": "winner",
            "type": "Address",
            "description": "Winner address"
          },
          {
            "name": "amount",
            "type": "i128",
            "description": "Prize amount"
          }
        ],
        "returns": {
          "type": "PayoutRecord",
          "description": "Payout record"
        },
        "authorization": "admin",
        "pausable": true,
        "gas_estimate": "medium"
      },
      {
        "name": "set_program_dependencies",
        "description": "Set dependencies for a program",
        "parameters": [
          {
            "name": "program_id",
            "type": "String",
            "description": "Program identifier"
          },
          {
            "name": "dependency_ids",
            "type": "Vec<String>",
            "description": "List of dependency IDs"
          }
        ],
        "returns": {
          "type": "()",
          "description": "Empty on success"
        },
        "authorization": "admin",
        "pausable": false,
        "gas_estimate": "medium"
      },
      {
        "name": "clear_program_dependencies",
        "description": "Clear all dependencies for a program",
        "parameters": [
          {
            "name": "program_id",
            "type": "String",
            "description": "Program identifier"
          }
        ],
        "returns": {
          "type": "()",
          "description": "Empty on success"
        },
        "authorization": "admin",
        "pausable": false,
        "gas_estimate": "medium"
      },
      {
        "name": "set_dependency_status",
        "description": "Set status for a dependency",
        "parameters": [
          {
            "name": "dependency_id",
            "type": "String",
            "description": "Dependency identifier"
          },
          {
            "name": "status",
            "type": "DependencyStatus",
            "description": "Dependency status"
          }
        ],
        "returns": {
          "type": "()",
          "description": "Empty on success"
        },
        "authorization": "admin",
        "pausable": false,
        "gas_estimate": "medium"
      },
      {
        "name": "set_paused",
        "description": "Update pause flags for operations",
        "parameters": [
          {
            "name": "lock",
            "type": "Option<bool>",
            "description": "Pause lock operations",
            "optional": true
          },
          {
            "name": "release",
            "type": "Option<bool>",
            "description": "Pause release operations",
            "optional": true
          },
          {
            "name": "refund",
            "type": "Option<bool>",
            "description": "Pause refund operations",
            "optional": true
          },
          {
            "name": "reason",
            "type": "Option<String>",
            "description": "Reason for pausing",
            "optional": true
          }
        ],
        "returns": {
          "type": "()",
          "description": "Empty on success"
        },
        "authorization": "admin",
        "pausable": false,
        "gas_estimate": "medium"
      },
      {
        "name": "emergency_withdraw",
        "description": "Emergency withdraw all program funds",
        "parameters": [
          {
            "name": "target",
            "type": "Address",
            "description": "Address to receive funds"
          }
        ],
        "returns": {
          "type": "()",
          "description": "Empty on success"
        },
        "authorization": "admin",
        "pausable": false,
        "gas_estimate": "high"
      }
    ],
    "view": [
      {
        "name": "program_exists",
        "description": "Check if any program exists",
        "parameters": [],
        "returns": {
          "type": "bool",
          "description": "True if program exists"
        },
        "authorization": "any",
        "pausable": false,
        "gas_estimate": "low"
      },
      {
        "name": "program_exists_by_id",
        "description": "Check if specific program exists",
        "parameters": [
          {
            "name": "program_id",
            "type": "String",
            "description": "Program identifier"
          }
        ],
        "returns": {
          "type": "bool",
          "description": "True if program exists"
        },
        "authorization": "any",
        "pausable": false,
        "gas_estimate": "low"
      },
      {
        "name": "get_program_dependencies",
        "description": "Get dependencies for a program",
        "parameters": [
          {
            "name": "program_id",
            "type": "String",
            "description": "Program identifier"
          }
        ],
        "returns": {